[{"id":"food_olive_oil","slug":"olive-oil","canonicalName":"Olive oil","aliases":[],"categoryId":"fats_oils","subgroupId":"plant_oils","status":"published","compositionStatus":"partial","defaultProfileId":"profile_olive_oil_fdc_171413","sourceSearchTerms":["Olive oil"],"preferredSourceOrder":["usda_fdc_foundation_2026_04","usda_fdc_fndds_2021_2023","usda_fdc_sr_legacy_2018"],"indiaReferenceCandidate":false,"compositionProfiles":[{"profileId":"profile_olive_oil_fdc_171413","label":"Oil, olive, salad or cooking","foodState":"other","processingLevel":"not_classified","preparationNotes":"Use this exact source-described state. Do not convert raw and cooked masses or infer suitability for eating raw.","basis":"per_100g_edible_portion","ediblePortion":{"percent":null,"status":"not_available"},"nutrients":[{"nutrientId":"energy_kcal","status":"calculated","unit":"kcal","value":884,"sourceRecordId":"usda_fdc_171413","methodNote":"USDA nutrient 1008; Calculated."},{"nutrientId":"energy_kj","status":"calculated","unit":"kJ","value":3700,"sourceRecordId":"usda_fdc_171413","methodNote":"USDA nutrient 1062; Calculated."},{"nutrientId":"water_g","status":"measured","unit":"g","value":0,"sourceRecordId":"usda_fdc_171413","methodNote":"USDA nutrient 1051; Analytical."},{"nutrientId":"protein_g","status":"measured","unit":"g","value":0,"sourceRecordId":"usda_fdc_171413","methodNote":"USDA nutrient 1003; Analytical."},{"nutrientId":"carbohydrate_total_g","status":"calculated","unit":"g","value":0,"sourceRecordId":"usda_fdc_171413","methodNote":"USDA nutrient 1005; Calculated."},{"nutrientId":"carbohydrate_available_g","status":"not_available","unit":"g","value":null,"sourceRecordId":"usda_fdc_171413","methodNote":"This source record does not supply this nutrient/form; no zero or conversion inferred."},{"nutrientId":"fiber_total_g","status":"estimated","unit":"g","value":0,"sourceRecordId":"usda_fdc_171413","methodNote":"USDA nutrient 1079; Derivation not supplied; retained as estimated, not measured."},{"nutrientId":"sugars_total_g","status":"estimated","unit":"g","value":0,"sourceRecordId":"usda_fdc_171413","methodNote":"USDA nutrient 2000; Assumed zero (Insignificant amount or not naturally occurring in a food, such as fiber in meat)."},{"nutrientId":"fat_total_g","status":"estimated","unit":"g","value":100,"sourceRecordId":"usda_fdc_171413","methodNote":"USDA nutrient 1004; Other procedure used from imputing."},{"nutrientId":"fat_saturated_g","status":"calculated","unit":"g","value":13.8,"sourceRecordId":"usda_fdc_171413","methodNote":"USDA nutrient 1258; Calculated."},{"nutrientId":"fat_monounsaturated_g","status":"calculated","unit":"g","value":73,"sourceRecordId":"usda_fdc_171413","methodNote":"USDA nutrient 1292; Calculated."},{"nutrientId":"fat_polyunsaturated_g","status":"calculated","unit":"g","value":10.5,"sourceRecordId":"usda_fdc_171413","methodNote":"USDA nutrient 1293; Calculated."},{"nutrientId":"omega_3_g","status":"not_available","unit":"g","value":null,"sourceRecordId":"usda_fdc_171413","methodNote":"This source record does not supply this nutrient/form; no zero or conversion inferred."},{"nutrientId":"omega_6_g","status":"not_available","unit":"g","value":null,"sourceRecordId":"usda_fdc_171413","methodNote":"This source record does not supply this nutrient/form; no zero or conversion inferred."},{"nutrientId":"cholesterol_mg","status":"estimated","unit":"mg","value":0,"sourceRecordId":"usda_fdc_171413","methodNote":"USDA nutrient 1253; Derivation not supplied; retained as estimated, not measured."},{"nutrientId":"sodium_mg","status":"measured","unit":"mg","value":2,"sourceRecordId":"usda_fdc_171413","methodNote":"USDA nutrient 1093; Analytical."},{"nutrientId":"potassium_mg","status":"measured","unit":"mg","value":1,"sourceRecordId":"usda_fdc_171413","methodNote":"USDA nutrient 1092; Analytical."},{"nutrientId":"calcium_mg","status":"measured","unit":"mg","value":1,"sourceRecordId":"usda_fdc_171413","methodNote":"USDA nutrient 1087; Analytical."},{"nutrientId":"iron_mg","status":"measured","unit":"mg","value":0.56,"sourceRecordId":"usda_fdc_171413","methodNote":"USDA nutrient 1089; Analytical."},{"nutrientId":"magnesium_mg","status":"measured","unit":"mg","value":0,"sourceRecordId":"usda_fdc_171413","methodNote":"USDA nutrient 1090; Analytical."},{"nutrientId":"phosphorus_mg","status":"measured","unit":"mg","value":0,"sourceRecordId":"usda_fdc_171413","methodNote":"USDA nutrient 1091; Analytical."},{"nutrientId":"zinc_mg","status":"measured","unit":"mg","value":0,"sourceRecordId":"usda_fdc_171413","methodNote":"USDA nutrient 1095; Analytical."},{"nutrientId":"copper_mg","status":"measured","unit":"mg","value":0,"sourceRecordId":"usda_fdc_171413","methodNote":"USDA nutrient 1098; Analytical."},{"nutrientId":"manganese_mg","status":"measured","unit":"mg","value":0,"sourceRecordId":"usda_fdc_171413","methodNote":"USDA nutrient 1101; Analytical."},{"nutrientId":"selenium_ug","status":"measured","unit":"µg","value":0,"sourceRecordId":"usda_fdc_171413","methodNote":"USDA nutrient 1103; Analytical."},{"nutrientId":"iodine_ug","status":"not_available","unit":"µg","value":null,"sourceRecordId":"usda_fdc_171413","methodNote":"This source record does not supply this nutrient/form; no zero or conversion inferred."},{"nutrientId":"vitamin_a_rae_ug","status":"estimated","unit":"µg RAE","value":0,"sourceRecordId":"usda_fdc_171413","methodNote":"USDA nutrient 1106; Assumed zero (Insignificant amount or not naturally occurring in a food, such as fiber in meat)."},{"nutrientId":"retinol_ug","status":"estimated","unit":"µg","value":0,"sourceRecordId":"usda_fdc_171413","methodNote":"USDA nutrient 1105; Assumed zero (Insignificant amount or not naturally occurring in a food, such as fiber in meat)."},{"nutrientId":"beta_carotene_ug","status":"estimated","unit":"µg","value":0,"sourceRecordId":"usda_fdc_171413","methodNote":"USDA nutrient 1107; Assumed zero (Insignificant amount or not naturally occurring in a food, such as fiber in meat)."},{"nutrientId":"thiamin_mg","status":"estimated","unit":"mg","value":0,"sourceRecordId":"usda_fdc_171413","methodNote":"USDA nutrient 1165; Derivation not supplied; retained as estimated, not measured."},{"nutrientId":"riboflavin_mg","status":"estimated","unit":"mg","value":0,"sourceRecordId":"usda_fdc_171413","methodNote":"USDA nutrient 1166; Derivation not supplied; retained as estimated, not measured."},{"nutrientId":"niacin_mg","status":"estimated","unit":"mg","value":0,"sourceRecordId":"usda_fdc_171413","methodNote":"USDA nutrient 1167; Derivation not supplied; retained as estimated, not measured."},{"nutrientId":"pantothenic_acid_mg","status":"estimated","unit":"mg","value":0,"sourceRecordId":"usda_fdc_171413","methodNote":"USDA nutrient 1170; Derivation not supplied; retained as estimated, not measured."},{"nutrientId":"vitamin_b6_mg","status":"estimated","unit":"mg","value":0,"sourceRecordId":"usda_fdc_171413","methodNote":"USDA nutrient 1175; Derivation not supplied; retained as estimated, not measured."},{"nutrientId":"biotin_ug","status":"not_available","unit":"µg","value":null,"sourceRecordId":"usda_fdc_171413","methodNote":"This source record does not supply this nutrient/form; no zero or conversion inferred."},{"nutrientId":"folate_food_ug","status":"estimated","unit":"µg","value":0,"sourceRecordId":"usda_fdc_171413","methodNote":"USDA nutrient 1187; Derivation not supplied; retained as estimated, not measured."},{"nutrientId":"folic_acid_ug","status":"estimated","unit":"µg","value":0,"sourceRecordId":"usda_fdc_171413","methodNote":"USDA nutrient 1186; Assumed zero (Insignificant amount or not naturally occurring in a food, such as fiber in meat)."},{"nutrientId":"folate_dfe_ug","status":"calculated","unit":"µg DFE","value":0,"sourceRecordId":"usda_fdc_171413","methodNote":"USDA nutrient 1190; Calculated."},{"nutrientId":"vitamin_b12_ug","status":"estimated","unit":"µg","value":0,"sourceRecordId":"usda_fdc_171413","methodNote":"USDA nutrient 1178; Derivation not supplied; retained as estimated, not measured."},{"nutrientId":"vitamin_c_mg","status":"estimated","unit":"mg","value":0,"sourceRecordId":"usda_fdc_171413","methodNote":"USDA nutrient 1162; Derivation not supplied; retained as estimated, not measured."},{"nutrientId":"vitamin_d_ug","status":"estimated","unit":"µg","value":0,"sourceRecordId":"usda_fdc_171413","methodNote":"USDA nutrient 1114; Assumed zero (Insignificant amount or not naturally occurring in a food, such as fiber in meat)."},{"nutrientId":"vitamin_e_mg","status":"measured","unit":"mg","value":14.4,"sourceRecordId":"usda_fdc_171413","methodNote":"USDA nutrient 1109; Analytical."},{"nutrientId":"vitamin_k_ug","status":"measured","unit":"µg","value":60.2,"sourceRecordId":"usda_fdc_171413","methodNote":"USDA nutrient 1185; Analytical."},{"nutrientId":"choline_mg","status":"measured","unit":"mg","value":0.3,"sourceRecordId":"usda_fdc_171413","methodNote":"USDA nutrient 1180; Analytical."}],"portions":[{"portionId":"portion_fdc_171413_88667","label":"1 tablespoon","grams":13.5,"status":"source_reported","sourceRecordId":"usda_fdc_171413","notes":"Dataset portion weight; household measures vary. Weight refers to this profile only."},{"portionId":"portion_fdc_171413_88669","label":"1 tsp","grams":4.5,"status":"source_reported","sourceRecordId":"usda_fdc_171413","notes":"Dataset portion weight; household measures vary. Weight refers to this profile only."},{"portionId":"portion_fdc_171413_88668","label":"1 cup","grams":216,"status":"source_reported","sourceRecordId":"usda_fdc_171413","notes":"Dataset portion weight; household measures vary. Weight refers to this profile only."}],"sourceRecords":[{"sourceRecordId":"usda_fdc_171413","sourceId":"usda_fdc_sr_legacy_2018","externalFoodId":"171413","externalDescription":"Oil, olive, salad or cooking","release":"April 2018 final","accessedAt":"2026-10-05T14:21:40Z","matchType":"exact","licenseNote":"USDA FoodData Central pub